{
  "name": "agent-harness",
  "description": "agent-harness workflow plugin for Claude Code and OpenAI Codex",
  "owner": {
    "name": "agent-harness maintainers"
  },
  "plugins": [
    {
      "name": "agent-harness",
      "source": "./plugins/agent-harness",
      "description": "Vendor-neutral agent workflow layer: plan, delegate by role, verify with gates, record evidence, and refine through reviewable proposals.",
      "version": "0.0.1",
      "category": "Productivity"
    }
  ]
}
